{
  "artifacts": {
    ".gitattributes": "e54c83aec897237a7b75759915ef0634b3466eae3614a8d676db2012d49faa9e",
    ".github/dependabot.yml": "4c835c01213d922e37a495e4c027c9fc5a37afe86939ac216d848f18750b19d2",
    ".github/workflows/ci.yml": "efe24ce5cbbaf44d0f899246c1b194d22530f9fc0c668a95a2b871e8c619da3d",
    ".github/workflows/extended.yml": "6fa0c037bbb78db3d4a734036b8901a63f76f6b69109c7fab2f6162ff41b76bc",
    ".github/workflows/release.yml": "cab273c80e52ba40f7c8145a24f3a15da4755e993f6b3dfdcdcaaedde69882d3",
    "LICENSE": "da71762cf01a96f08d8c167d2bf9a1de314783c50d00d865bdc353988988a62b",
    "docs/code-documentation-standard.md": "86c505d61ecf7c87f014dfc421b083379b46d3796e194e1e17fcf88b6ec6d1ec",
    "scripts/release.mjs": "2820461d5551fff706db0724bd1f30bcfdaad3d2be70367b03f5c24280621bdb",
    "threadlabs.config.json": "d24149e895c0611a8b85784ee302ecc837e9244897c3e32f98944bb0c51bb964"
  },
  "modules": {
    "agents": "1.0.0",
    "code-documentation": "1.0.0",
    "core": "1.0.0",
    "cross-platform": "1.0.0",
    "freshness": "1.0.0",
    "generated-artifacts": "1.0.0",
    "github": "1.0.0",
    "npm-publish": "1.0.0",
    "public-api": "1.0.0",
    "typescript-node": "1.0.0"
  },
  "schemaVersion": "1.0",
  "standardVersion": "1.0.0"
}
